index,desc,location,size,value
177,This is a Spacious and well maintained 6 bedrooms double storied house sitting on half acre mature flat well kept garden. MAIN...,"Peponi road, Peponi, Nairobi",6.0,85000000.0
178,This is a new and modern 6 bedrooms all en suite Ambassadorial house located in a quiet and secure area in Runda...,"Mimosa drive, Runda, Nairobi",6.0,130000000.0
179,"A stunning. 6br double storey house on 1. 1acres of land in Avery secure area of Lavington. 5 bedrooms all en suite,...","Lavington, Nairobi",6.0,240000000.0
180,This is an old but Beautiful 5 Bed Room Residence. Located in a Serene Neighborhood within a Gated Community. >Main House has...,"Shinyaru Road, Loresho Central, Loresho, Nairobi",5.0,85000000.0
181,Magnificent. full of beauty,"Runda, Nairobi",5.0,28950000.0
182,a cosy five bedroom all en suite standalone bungalow on sale in Karen on a serene cul-de-saac.,"Karen, Nairobi",5.0,55000000.0
183,Located along Getathuru road off Lower kabete In a gated community Seating on almost half an acre land Spacious lounge with a...,"OFF LOWER KABETE, Westlands, Nairobi",5.0,110000000.0
184,"Classic home! Spacious lounge with a fire place, Fitted kitchen with a breakfast area, Study room, Large terrace with open fire p...","Karen, Karen, Nairobi",5.0,80000000.0
185,Located in Runda is this beautiful 5 bedrooms double story house sitting on 0. 5 well kept garden in good condition. The...,"Runda, Runda, Nairobi",5.0,100000000.0
186,BRAND NEW and stunning wrapped in character and charm Located in an extremely serene environment Spacious sunken lounge with a fu...,"OFF PAN AFRIC DRIVE, Runda, Nairobi",5.0,140000000.0
187,"A 5 Bedroom ambassadorial house, sitting on approximately 1 acre of flat terrain. The house is within a secure gated community in...","Karen, Karen, Nairobi",5.0,90000000.0
188,Being in the heart of Runda Estate is this 5 Bedrooms Villa in a gated compound With easy proximity to UN offices...,"Mimosa Road, Runda, Nairobi",5.0,110000000.0
189,"Situated in karen""s most prestigious location address â€“ nandi road in nairobi kenya, heavenly abode of only 6 ultra-luxurious mod...","Miotoni Rd Karen, Karen, Nairobi",5.0,120000000.0
190,"Set on the slopes of the Mbagathi river karen overlooking the picturesque Ngong hills with lush indigenous vegetation, the develo...","Mbagathi Ridge, Karen, Nairobi",5.0,110000000.0
191,"It, s a precious and lustrous double storey house 5bedroom all ensuite with a staff quarters for two. located Kitisuru in a...","Kitisuru Rd Kitisuru, Kitisuru, Nairobi",5.0,75000000.0
192,"Well presented 5 Bedrooms family home in serene and quiet environs of great Kitisuru Estate With easy proximity to UN offices, Vi...","Kitisuru Road, Kitisuru, Nairobi",5.0,75000000.0
193,Immaculately done is this 5 bedrooms Villa in a gated of 4 houses With extra modern finishes and fittings Few minutes drive...,"Kyuna Road, Kyuna, Nairobi",5.0,100000000.0
194,"Strategically located off NGECHA Road within a Low Population Density Gated Community, New Kitisuru - NSSF Estate is this Beautif...","KITISURU - GETATHURU ROAD, Kitisuru, Nairobi",5.0,85000000.0
195,"Exclusive and Luxury development in Runda For Sale, This brand new 5 Bedroom House is a sheer exploration of luxury with modern...","Gardenia Rd Kitisuru, Runda, Nairobi",5.0,260000000.0
196,"Impeccably presented family home in a good neighbourhood of Runda With a easy proximity to UN offices, German School, Rosslyn Aca...","Mimosa Road, Runda, Nairobi",5.0,110000000.0
197,"Exclusive and Luxury development in Runda For Sale, This brand new 5 Bedroom House is a sheer exploration of luxury with modern...","Gardenia Rd Kitisuru, Runda, Nairobi",5.0,260000000.0
198,"A 5 bedroom, all en-suite country home located in one of the charming and convenient leafy suburbs in Nairobi karen, a place...","Karen Ngong Rd, Karen, Nairobi",5.0,75000000.0
199,"6 units on a 3 acre gated community. Ground Floor: Living room, Dining room, Guest bedroom, Cloak room, Kitchen, Utility, Pantry....","THE GROVE, Baraka Road Limuru, Redhill, Nairobi",5.0,80000000.0
200,"Strategically located in Runda - Eagle Park is this 5 Bed room Double Story house. All Bedrooms are en suite, Separate Sitting...","PAN AFRICAN INS AVENUE, Runda, Nairobi",5.0,140000000.0
201,A newly built 5 Bedrooms Massive Town house in a quiet environment of Kitisuru With overlooking breath taking views Walking dista...,"Kitisuru Road, Kitisuru, Nairobi",5.0,110000000.0
202,"Classic home! Spacious lounge with a fire place, Fitted kitchen with a breakfast area, Study room, Large terrace with open fire p...","Windy Ridge Nairobi, Karen, Nairobi",5.0,115000000.0
203,"This grand 6 bedroom house sits on 1 acre and it is located in the central parts of Karen, with an access...",,5.0,105000000.0
204,Its a precious and lustrous double storey house 5 bedroom all en suite with a staff quarters for two. located in runda...,"runda mimosa road, Runda, Nairobi",5.0,120000000.0
205,This stylish urban villa perfectly balances modern finishes with comfortable living; architecturally designed to meet your needs ...,"Karen, Karen, Nairobi",5.0,80000000.0
206,House Standing on 3/4 Acres of Prime Plot For Sale The House is 90% Done Has 5 Bedrooms +2 Dsq Has A...,"Habiscus Road, Runda, Nairobi",5.0,60000000.0
207,New home for sale. These are luxurious yet distinct modern villas located at the heart of Karen. Their unique design ensures a...,"627 karen, Karen, Nairobi",5.0,105000000.0
208,Welcome to where luxury and class are inter twinned as this handcrafted masterpiece is strategically located in the serene and le...,"Karen, Karen, Nairobi",5.0,115000000.0
209,"* Located at the quiet and serene environment of Lavington * 5 minutes walk to Lavington Shopping Centre * Features 5 bedrooms,...","Lavington, Lavington, Nairobi",5.0,75000000.0
210,"Now is the time! Fabulous 5 bedroom home on an 1/8th in Langata, is looking for new family. If you're looking for...",,5.0,50000000.0
211,"looking for a house with next level luxury? Newly built home! Located in Muthaiga north, one of the highly regarded neighborhoods...","Muthaiga North, Nairobi",5.0,75000000.0
212,"Magnificent 5 bedrooms house on 3 levels in Karen, in a gated community of 20 each on 1 acre/ All 5 bedrooms...","Karen, Karen, Nairobi",5.0,125000000.0
213,* All rooms are en-suite with in-built wardrobes. * The house has an expansive lounge with a modern fireplace and has a...,"Karen, Karen, Nairobi",5.0,80000000.0
214,This charming home is in a serene gated complex in Karen. It is spacious and has a well manicured garden with mature...,,5.0,115000000.0
215,Located near the Road A charming two leveled 5 bedrooms stand alone double storey house set on one acre plot belonging to...,"Lavington Muhoya, Lavington, Nairobi",5.0,270000000.0
216,Lovely new 5 bedrooms house for sale is located in Lavington . It has the following features : - All en suite...,"Lavington, Nairobi",5.0,80000000.0
217,"looking for a house with next level luxury? Newly built home! Located in Muthaiga north, one of the highly regarded neighborhoods...","Muthaiga North, Nairobi",5.0,75000000.0
218,"This beautiful house is in the affluent residential suburb of Nairobi, that is, The New Kitsuru Estate. It has 5 bedrooms and...","New Kitsuru Estate, Kitisuru, Nairobi",5.0,130000000.0
219,This wonderful property Spacious and viewing is a must to appreciate this 5 bed roomed detached property available to let unfurni...,"Runda, Nairobi",5.0,95000000.0
220,Its a precious and lustrous double storey house 5 bedroom all en suite with a staff quarters for two. located in runda...,"off ruaka road, Runda, Nairobi",5.0,245000000.0
221,"Wealthlink presents a 5br standalone house in the heart of Runda, Flametree. It sits on half acre, in a secure and pleasant...","Runda, Runda, Nairobi",5.0,85000000.0
222,These luxury villas with excellent interior are located at the greens of Karen with a 24 hour security. The house has magnificent...,"Unnamed Road Nairobi, Karen, Nairobi",5.0,150000000.0
223,Located close to the UN OFFICES is this magnificent and spacious 5 bedrooms all ensuite double storied house sitting on half acre...,"Golden Eagle Valley Kitisuru, Runda, Nairobi",5.0,140000000.0
224,HOUSE FOR SALE IN MOUNTAIN VIEW ESTATE A 5 Bedroom house with a garage and a servant's quarter. Set on 1/4 acre...,"Hinga Road Kangemi, Mountain View, Nairobi",5.0,42000000.0
225,HOUSE FOR SALE IN MOUNTAIN VIEW ESTATE A 5 Bedroom house with a garage and a servant's quarter. Set on 1/4 acre...,"Hinga Road Kangemi, Mountain View, Nairobi",5.0,42000000.0
226,"Exclusive and Luxury development in Runda For Sale, This 5 Bedroom House is a sheer exploration of luxury with modern exteriors a...","Flame Tree Dr Kitisuru, Runda, Nairobi",5.0,260000000.0
227,An elegant house located in the heart of Runda in a serene environs. It has the following features; It is two levels...,"Off Ruaka Road, Runda, Nairobi",5.0,250000000.0
228,"Located in the serene and quiet neighborhood of Riverside is the 5 bedroom house offering unparalleled luxury. Its near malls, sc...","Riverside, Nairobi",5.0,65000000.0
229,Runda A beautiful 5 bedroom double storey house for rent sitting on 1/2 acre mature garden Large step-down lounge with fire place...,"Runda, Nairobi",5.0,85000000.0
230,Situated in the heart of Karen is this spectacular and spacious property. Set of 5 acres with an indoor swimming pool and...,,5.0,650000.0
231,Its a precious and lustrous 5 bedroom double storey house all ensuite with a staff quarters for three located in Kileleshwa in...,"mandera road, Kileleshwa, Nairobi",5.0,260000000.0
232,Situated in the heart of Karen is this spectacular and spacious property. Set of 5 acres with an indoor swimming pool and...,,5.0,650000.0
233,"-This a 5 bedroom double storey . -All bedrooms are en-suite, -Sunken lounge with fire place, -Spacious kitchen, -Laundry area, -...","Emirates Cl Syokimau, Syokimau, Nairobi",5.0,28000000.0
234,"Strategically located in Runda - Eagle Park is this 5 Bed room Double Story house. Ground floor. 2 Bed Rooms, Both en...","PAN AFRICAN INS AVENUE, Runda, Nairobi",5.0,140000000.0
235,"Luxurious 5 bedrooms for sale is located in Lavington FEATURES ARE : - Modern design bedrooms with wooden flooring , in-built war...","Lavington, Nairobi",5.0,65000000.0
236,"An elegant well presented house on 0. 6 acre of beautiful garden. Living room, dining room, study, 5 ensuite bedrooms, fitted kit...","Nyari, Nairobi",5.0,170000000.0
237,"Five Bedroom House located in Syokimau, off Community road. The house oozes with eye-catching amplitude of space. Tucked in a ser...","Community Rd Syokimau, Syokimau, Nairobi",5.0,13500000.0
238,New built 5 bedroom with sq in Kitisuru for sale in gated community. -Modern finishes - All en suite -Spacious luxurious rooms...,"Kitisuru, Nairobi",5.0,60000000.0
239,Magnificently done and Strategically Located in the heart of Runda is this Newly Built : >5 Bed Rooms Double Story House. *All...,"RUAKA ROAD, RUNDA, Runda, Nairobi",5.0,245000000.0
240,"Beautifully designed 5 bedrooms villa sitting on its own compound. The house has spacious bedrooms, all en-suite and a walk in cl...","Karen, Nairobi",5.0,105000000.0
241,"This is a beautiful Well presented double storey house located in the heart of Runda Estate and has the following features, Sitti...","Ruaka Road., Runda, Nairobi",5.0,85000000.0
242,Located close to U. N. GIGIRI OFFICES GERMAN SCHOOL and BRAEBURN SCHOOL. and INTERNATIONAL SCHOOL OF KENYA AND PEPONI SCHOOL. A w...,"Kitisuru road, Kitisuru, Nairobi",5.0,70000000.0
243,"Ambassadorial house on one acre mature garden, high end finishes, excellent security, garage for 7 cars, 8 private rooms for eith...","Dik Dik Gardens , Kileleshwa, Nairobi",5.0,280000000.0
244,"Beautiful 5brm double storey standalone house sitting on 0. 5 acre, features; # all en suite # servants quarter # family lounge...","Pan African avenue , Runda, Nairobi",5.0,140000000.0
245,These luxury villas with opulent interior are located at the greens of Karen with a 24 hour security. The house has magnificent...,"Unnamed Road Nairobi, Karen, Nairobi",5.0,150000000.0
246,"This stunning home is at a secure, serene and established area in Karen. It is a 5 bedroom all en-suite stand alone...",,5.0,55000000.0
247,"This one of the beautiful house go have in Kitsuru, it is designed as ambassadorial house, whereby it has good environment and...","Kitisuru, Nairobi",5.0,150000000.0
248,Very spacious 5 bedrooms all en suite town house for sale is located in lavington . FEATURES : - All bedrooms are...,"Lavington, Nairobi",5.0,65000000.0
249,Executive 5 bedroom Townhouse 4 Rooms Ensuite spacious rooms open plan kitchen 4 burner table top cooker & oven massive storage c...,"Wananchi Road Syokimau, Syokimau, Nairobi",5.0,25000000.0
250,"The property is in excellent condition, the 5 bedroom offers luxury living in the heart of Ridgeways. Has a beautiful Front lone....","Ridgeways, Nairobi",5.0,80000000.0
251,New home for sale. These are luxurious yet distinct modern villas located at the heart of Karen. Their unique design ensures a...,"Karen Nairobi, Karen, Nairobi",5.0,105000000.0
252,Modern High-End 5 bedroom house in a secured community in Ridgeways for Sale. This magnificent property is on half an acre with...,"Ridgeways, Nairobi",5.0,90000000.0
253,5 BEDROOM Maisonette En-suite Lavington for sale. 5 Bedroom Maisonette for sale in Lavington. Built in a calm enviroment suitable...,"29 Chalbi Dr, Lavington, Nairobi",5.0,50000000.0
254,This is brand new gated community of 13 stand-alone homes in a sought-after location along Lower Kabete road only a few meters...,"Lower Kabete Loresho, Kitisuru, Nairobi",5.0,125000000.0
255,"The property is in excellent condition, the 5 bedroom offers luxury living in the heart of Ridgeways. Has a beautiful Front lone....","Ridgeways, Nairobi",5.0,80000000.0
256,Luxurious 5 bedrooms executive townhouse for sale is located in Lavington. - It is a modern designed townhouse in a gated communi...,"Lavington, Nairobi",5.0,110000000.0
257,Five bedroom house on 0. 5 acres land along Runda mae is out for sale. The property is neighboring Embassy of Romania...,"Mae Rdge Kitisuru, Runda, Nairobi",5.0,95000000.0
258,"Situated in Karen's most prestigious location address , heavenly abode of only 6 ultra-luxurious modern villas called as smart ho...","Karen, Nairobi",5.0,160000000.0
259,Are you looking for Character and charm wrapped for you in one piece? Located in an extremely serene environment Spacious sunken ...,"OFF PAN AFRICA ROAD, Runda, Nairobi",5.0,140000000.0
260,"-Located in Runda, Asking Ksh 90 Million. (Negotiable) - 5 bedroom(2 en-suite), wooden ceiling - A separate TV room - 5 bathrooms...","Northern Bypass Rd Kitisuru, Runda, Nairobi",5.0,90000000.0
261,"An exclusive private gated community in Karen, is close to everything in Karen yet tucked away from it all. Conveniently located ...","Langata Rd Nairobi, Karen, Nairobi",5.0,105000000.0
262,Located in the quiet neighborhood of Garden estate is this lovely 5 bedroom house providing the suburban feeling to its occupants...,"Marurui Rd Nairobi, Garden Estate, Nairobi",5.0,60000000.0
263,5 Bedroom TOWN house lavington 5 Bedroom and SQ Town house in Lavington Chalbi drive for sale. 5 UNITS in the compound...,"29 Chalbi Dr, Lavington, Nairobi",5.0,75000000.0
264,This newly built palatial house is located in a secure location off Ruaka Road in Runda. It is tastefully and aesthetically finis...,"Runda, Nairobi",5.0,250000000.0
265,Located along Kanyagia Rd off Marurui rd in the quiet neighbourhood of Garden estate is this lovely 5 bedroom house providing the...,"Marurui Rd Nairobi, Garden Estate, Nairobi",5.0,63500000.0
266,5 BEDROOM VILLA PLUS DSQ FOR RENT IN RIVERSIDE Located near the German embassy and the Ugandan high commission spacious kitchen w...,"near german embassy, Riverside, Nairobi",5.0,48000000.0
267,Located in the quiet neighborhood of Garden estate is this lovely 5 bedroom house providing the suburban feeling to its occupants...,"Marurui Rd Nairobi, Garden Estate, Nairobi",5.0,60000000.0
268,This house is located in the heart of Kilimani in a serene environs. It has the following features; It is three levels...,"Off Oledume road, Kilimani, Nairobi",5.0,200000000.0
269,"Situated in karen""s most prestigious location address â€“ nandi road in nairobi kenya, heavenly abode of only 6 ultra-luxurious mod...","Miotoni Rd Karen, Karen, Nairobi",5.0,120000000.0
270,A beautiful standalone house situated in a tranquil and secure compound in Karen. Sitting on 0. 5 acre piece of land with...,"Karen, Nairobi",5.0,55000000.0
271,"Stunning, elegant 5 bedroom house is up for sale in a secure neighbourhood in the hearts of Karen. it is in its...","Unnamed Road Nairobi, Karen, Nairobi",5.0,60000000.0
272,Well best maintained house for sale in spring velly nears shell petrol station good friendly neighbours warm house wooden floor C...,"Spring Valley, Nairobi",5.0,45000000.0
273,Presenting this 5 bedroom house tucked in the serene environment of Kitisuru with beautiful scenery of the surrounding area. This...,"Kitisuru, Nairobi",5.0,110000000.0
274,"This is Beautiful well presented 5 bedroom Ambassadorial Home land on sale in Gigiri area, with close proximity to shopping malls...","Gigiri, Nairobi",5.0,150000000.0
275,"Beautiful townhouse in Lavington , this new development boasts 5 bedrooms all en suite , three storey of lavishness and modern fi...","Lavington, Nairobi",5.0,70000000.0
276,"This 5 Bedroom Brand new beautiful home has a downstairs cloakroom, a light airy sitting room and an ample well presented kitchen...","Muthaiga North, Nairobi",5.0,75000000.0
277,"Living is easy in this impressive, generously spacious residence with great views and access","Kigwaru Gardens Dr Kitisuru, Runda, Nairobi",5.0,80000000.0
278,"This warm, and yet maginifcent home is located in the exclusive Ridgeways Springs community and sits on half an acre. It is...",,5.0,86000000.0
279,"Classic home! Spacious lounge with a fire place, Fitted kitchen with a breakfast area, Study room, Large terrace with open fire p...","Windy Ridge Karen, Karen, Nairobi",5.0,115000000.0
280,Magnificently done and Strategically Located in a Serene Area of Runda few meters off Ruaka Road and Neighboring Several Embassie...,"Ruaka Road, Runda, Nairobi",5.0,245000000.0
281,Magnificently done and Strategically Located in a Serene Area of Runda few meters off Ruaka Road and Neighboring Several Embassie...,"Ruaka Road, Runda, Nairobi",5.0,245000000.0
282,This is a spacious 5 bedroom house in the heart of Ridgeways asking 89 million. All the 5 bedrooms are en-suite and...,"Garden Estate Rd Nairobi, Ridgeways, Nairobi",5.0,89000000.0
283,light in a secure gated compound of 10 units. The main house has 4 en-suite bedrooms plus the guesthouse which has a...,"Karen Nairobi, Karen, Nairobi",5.0,90000000.0
284,"This is Beautiful well presented 5 bedroom Ambassadorial Home land on sale in Gigiri area, with close proximity to shopping malls...","Gigiri, Nairobi",5.0,150000000.0
285,5 BEDROOM Townhouses Newly built for Sale in Lavington. Located in Lavington in a gated community of seven units are these beauti...,"Naushad Merali Dr Maziwa, Lavington, Nairobi",5.0,72000000.0
286,Located off Lower Kabete at Shanzu Lane In a compound of other four houses Newly built has both Charm and Character Spacious...,"OFF SHANZU ROAD, Westlands, Nairobi",5.0,65000000.0
287,A beautiful standalone house situated in a tranquil and secure compound in Karen. Sitting on 0. 5 acre piece of land with...,"Karen, Nairobi",5.0,55000000.0
288,This property for sale in Kitisuru is in a secure area and has a stone perimeter wall. The property is in a...,"2.0A1 Kitisuru Rd, Kitisuru, Nairobi",5.0,67500000.0
289,It sits on a 1/4 acre piece of land All rooms are en suite with a Jacuzzi The house has a modern...,"Kiu River Rd Kahawa Sukari, Kahawa sukari, Nairobi",5.0,55000000.0
290,"Located in Runda on close to the UN with mature trees , prime residential plot measuring 1. 3 acres with a 14...","Runda near to the UN , Runda, Nairobi",5.0,160000000.0
291,"Strategically located in Runda - Eagle Park is this 5 Bed room Double Story house. All Bedrooms are en suite, Separate Sitting...","PAN AFRICAN INS AVENUE, Runda, Nairobi",5.0,140000000.0
292,This is a five bedrooms house for sale located in suburb of Lavington area it has the following features specious kitchen and...,"Mugumo Rd Maziwa, Lavington, Nairobi",5.0,100000000.0
293,newly developed gated community on approximately five acres with five top quality ready new homes each on about an acre. Overlook...,"Mbagathi Ridge Nairobi, Karen, Nairobi",5.0,115000000.0
294,"This rustic home sits on half an acre and is located in the highly sought after area in Karen, Miotoni. It is...",,5.0,130000000.0
295,newly developed gated community on approximately five acres with five top quality ready new homes each on about an acre. Overlook...,"Mbagathi Ridge Nairobi, Karen, Nairobi",5.0,115000000.0
296,House to let at runda it has the following features specious kitchen and all bedrooms en-suite with fixed wardrobe Amenities incl...,"Pan African Insurance Ave Kitisuru, Runda, Nairobi",5.0,500000.0
297,This is a spacious 5 bedroom house in the heart of Runda asking 105m. This house is highly secured with electric fence...,"Runda Drive Kitisuru, Runda, Nairobi",5.0,105000000.0
298,Salient features: -five bedroom master en suit -1/2 acre level plot -perimeter wall -close UN Gigiri and Ridge-ways mall -very se...,"Kigwa Rd Nairobi, Ridgeways, Nairobi",5.0,65000000.0
299,"Beautiful 5 bedrooms house in Runda. The property enjoys proximity to Village market, UN, Embassy of the United States, Canadian ...","Mimosa Cl Kitisuru, Runda, Nairobi",5.0,90000000.0
300,Sitting on half acre land is this beautiful 5 bedroom bungalow that is up for sale in Kerarapon. It is located in...,"Kerarapon Drive Karen, Karen, Nairobi",5.0,45000000.0
301,This Garden estate property is stunning. The substantial 5 bedroom (all ensuite) family home is situated approximately 7 min from...,"Garden Estate, Nairobi",5.0,60000000.0
302,"This is Beautiful well presented 5 bedroom Ambassadorial Home land on sale in Gigiri area, with close proximity to shopping malls...","Gigiri, Nairobi",5.0,150000000.0
303,Large balconies to the bedrooms and the family room. 5 bedrooms all en-suite with the master bedroom fitted with a Jacuzzi. Open....,"Lavington, Lavington, Nairobi",5.0,72000000.0
304,Awesome 5 bedroom house in Lavington with amazing finishing and decors All the bedrooms are spacious and en-suite with modern toi...,"Lavington, Lavington, Nairobi",5.0,75000000.0
305,An Exclusive gated community located in Kitisuru. The rustic yet modern houses exceed all your demands to offer the epitome of lu...,"Kiambu Rd Kiambu County, Kitisuru, Nairobi",5.0,140000000.0
306,Located at runda Built in on half acre land Good neighbourhood Good architectural design,"Runda, Nairobi",5.0,165000000.0
307,An elegant house located in the heart of Whispers in a serene environs. It has the following features; It is two levels...,"Whispers, Runda, Nairobi",5.0,140000000.0
308,An adorable 5 bedroom apartment is situated in the suburbs of Karen along langata road. Its serene and secure location is a...,"Langata Rd, Karen, Nairobi",5.0,80000000.0
309,"Townhouse for sale in Spring Valley Spacious Modern and Luxcurious Townhouse For Sale, It has 5 Br Ensuit +2 Dsq with excellent...","Lower Kabete Rd Spring Valley, Westlands, Nairobi",5.0,85000000.0
310,These are luxurious yet distinct modern villas located at the heart of Karen. Their unique design ensures a signature lifestyle f...,"Karen, Karen, Nairobi",5.0,100000000.0
311,This a specious 5 bedroom house on 0. 6 acer land in the suburb of runda the house has staff quarter and...,"Faith Dr Kitisuru, Runda, Nairobi",5.0,72000000.0
312,This house is located in the heart of General Mathenge in a serene environs. It has the following features; It is three...,"Off General Mathenge, Spring Valley, Nairobi",5.0,105000000.0
313,"Lovely beautiful and spacious 5 bedrooms double story house with 1 bedroom self-contained geustwing wing, fitting kitchen separat...","Thego lane , Loresho, Nairobi",5.0,80000000.0
314,Located in the exclusive and serene area of Kileleshwa at DIKDIK Gardens This gorgeous house exemplifies both Charm AND Character...,"OFF MANDERA ROAD, Kileleshwa, Nairobi",5.0,300000000.0
315,"This is a beautiful 5Bedroomed ambassadorial house tucked within a clean, secure and serene neighborhood in the lovely suburbs of...","Runda, Nairobi",5.0,90000000.0
316,"Located close to the UN offices, A beautiful 5 bedrooms house in a gated compound located in the tranquil Runda Estate all...","Runda close to the UN , Runda, Nairobi",5.0,90000000.0
317,"Located in the exclusive Miotoni Karen area near The Hub, Karen Country Lodge, Karen Hospital and international schools such as H...","Miotoni Rd Karen, Karen, Nairobi",5.0,115000000.0
318,A charming 5 bedrooms stand alone home on slightly bigger than half an acre with well manicured garden . The ground floor...,"Runda near to the UN , Runda, Nairobi",5.0,150000000.0
319,"Classic home! Spacious House with a fire place, Fitted kitchen with a breakfast area, Study room, Large terrace with open fire pl...","Runda Vale Kitisuru, Runda, Nairobi",5.0,100000000.0
320,"This classic 5 bed room house and a separate SQ for 2 with the latest design is fully furnished with modern furniture,...","United Nations Ave Kitisuru, Gigiri, Nairobi",5.0,250000000.0
321,"Luxury townhouse on 1/2 acre in Karen 5 bedrooms All ensuite Modern fitted kitchen with a pantry, hood and a microwave Bright...","Miotoni Rd Karen, Karen, Nairobi",5.0,100000000.0
