index,desc,location,size,value
1,Ambassadorial Palace in Spring Valley,"peponi road, Spring Valley, Nairobi, Nairobi",11.0,280000000.0
2,Spring Valley Ambassadorial Palace,"Spring Valley, Nairobi, Nairobi",11.0,290000000.0
3,10 Bedroom House in Karen- 3KE1375839,"Hardy, Karen, Nairobi, Nairobi",10.0,150000000.0
4,10 Bedroom House For Sale In Karen (Kenya) - 3KE1375839,"Karen, Nairobi, Nairobi",10.0,150000000.0
5,10 Bedroom House for sale in Spring Valley,"Spring Valley, Spring Valley, Nairobi, Nairobi",10.0,315000000.0
6,Magnificient 10 bed Mansion on half acer in Kar,"Koitabas Road, Karen, Nairobi, Nairobi",10.0,140000000.0
7,Exclusive 10 Bedroom Townhouse in Lavington,"Lavington, Lavington, Nairobi, Nairobi",10.0,380000000.0
8,10 Bedroom Town-House for sale in Karen,"Karen, Nairobi, Nairobi",10.0,40000000.0
9,5  Bedroom House  To Let,"Gigiri, Gigiri, Nairobi, Nairobi",10.0,300000000.0
10,2 Exceptional Houses in the Heart of Old Muthaiga on 1.8 acres.,"Off Tchui Lane - Old Muthaiga, Muthaiga, Nairobi, Nairobi",9.0,450000000.0
11,9 bedrooms townhouse in kiamumbi kamiti road 7 ensuite,"Kiamumbi, Nairobi, Nairobi",9.0,42000000.0
12,9 Bedroom House for sale in Kisumu Cbd,"Kisumu, Achieng' Oneko Rd, Riruta, Nairobi, Nairobi",9.0,80000000.0
13,Colonial Style 9 Bedroom Home for sale,"Lower Kabete, Nairobi, Nairobi",9.0,180000000.0
14,8 Bedroom Townhouse Redhill Limuru,"Limuru Road, Redhill, Limuru road, Nairobi, Nairobi",8.0,67000000.0
15,Plot with Two Houses on Kyuna Road,"Kyuna Rd, Kyuna, Nairobi, Nairobi",8.0,145000000.0
16,8 Bedroom House on 2.5 Acres,"Gigiri, Nairobi, Nairobi",8.0,650000000.0
17,8 Bedroom House in Karen,"Karen, Karen, Nairobi, Nairobi",8.0,150000000.0
18,Stylish Courtyard Home in Kikenni,"Karen & Langata, Karen, Nairobi, Nairobi",8.0,0.0
19,8 Bedroom House in Kitisuru,"Kitisuru, Kitisuru, Nairobi, Nairobi",8.0,145000000.0
20,8 Bedroom Townhouse for sale in Lavington,"Muthangari Road, Lavington, Nairobi, Nairobi",8.0,80000000.0
21,8 Bedroom House in Karen,"Karen, Nairobi, Nairobi",8.0,85000000.0
22,"6 Bedroom Home & Guest House on 33 Acres, Mukoma Estate","Langata, Nairobi, Nairobi",8.0,165000000.0
23,8 bedroom House for sale in Nyari,"Red Hill Road, Nyari, Nairobi, Nairobi",8.0,120000000.0
24,8 Bedroom House for sale in Lavington,"James Gichuru, Lavington, Nairobi, Nairobi",8.0,180000000.0
25,Karen-Outstanding 8 Bedroom House,"Karen-outstanding 8 bedroom house for sale, Karen, Nairobi, Nairobi",8.0,80000000.0
26,"4 Bedroom Main House & Guest Cottages on 3.2 Acre of Land, Karen","Karen, Nairobi, Nairobi",8.0,175000000.0
27,8 Bedroom House  for sale,"MUSA GITAU ROAD, Lavington, Nairobi, Nairobi",8.0,150000000.0
28,8 bedroom All Ensute Townhouse for sale in Runda,"Ruaka Drive, Runda, Nairobi, Nairobi",8.0,120000000.0
29,8 bedroom House for sale in Nyari,"Nyari, Nyari, Nairobi, Nairobi",8.0,125000000.0
30,KAREN - 3 & 4 BEDROOMS HOUSES(X 2) ON 2 ACRES.,"OFF WINDY RIDGE, Karen, Nairobi, Nairobi",7.0,165000000.0
31,7 Bedroom in Runda Mimosa Vale,"mimosa valley, Runda, Nairobi, Nairobi",7.0,100000000.0
32,World Class Luxurious 5 Bedrooms Plus 2 Bedrooms Guest Wing Home in Runda.,"Runda, Nairobi, Nairobi",7.0,150000000.0
33,"Beauty, Passion, Breathtaking ! 7 Bedroom House","spring valley, Spring Valley, Nairobi, Nairobi",7.0,150000000.0
34,Ambassadorial Houses For Sale Along Kanjata Rd Lavington with Swimming Pool,"kanjata rd, Lavington, Nairobi, Nairobi",7.0,250000000.0
35,Luxurious  7 Bedrooms  House  in Runda,"Runda, Nairobi, Nairobi",7.0,220000000.0
36,7 Bedroom House for sale in Loresho Crescent on Approximately 12 Acre Land,"loresho crescent, Loresho, Nairobi, Nairobi",7.0,85000000.0
37,3/4 Acre,"Isaac Gathanju road, Lavington, Nairobi, Nairobi",7.0,180000000.0
38,7 Bedroom House in 1 Acre Land,"Thigiri, Nairobi, Nairobi",7.0,175000000.0
39,"Villa- Ridgeways, Kiambu Road","Ridgeways kiambu road, Ridgeways, Nairobi, Nairobi",7.0,195000000.0
40,Spacious 7 Bedroom Maisonette in Kitengela,"Kitengela, Kiserian, Nairobi, Nairobi",7.0,14500000.0
41,2 Beautiful Homes in Tranquil Karen Location,"Karen, Nairobi, Nairobi",7.0,165000000.0
42,Touch of class! Runda Mimosa 7 bed Townhouse.,"Runda, Nairobi, Nairobi",7.0,140000000.0
43,7 bedroom House for sale in Kitisuru,"Kitisuru, Kitisuru, Nairobi, Nairobi",7.0,140000000.0
44,Modern 7 Bedroom House in Thome,"Mukuyu road, Thome, Nairobi, Nairobi",7.0,55000000.0
45,7 Bedroom House for sale in Runda,"Runda, Runda, Nairobi, Nairobi",7.0,150000000.0
46,House for sale in Karen Estate,"Karen, Nairobi, Nairobi",7.0,95000000.0
47,Thome House next to Windsor,"Thome, Nairobi, Nairobi",7.0,60000000.0
48,104 Acres With A 5 Bedroom House for sale in Karen (Miotoni),"Miotoni Road, Karen, Nairobi, Nairobi",7.0,640000000.0
49,"Amazing 7 Bedroom House, Westlands","Westlands, Westlands, Nairobi, Nairobi",7.0,350000000.0
50,7 Bedroom House,"dog unit, Langata, Nairobi, Nairobi",7.0,27000000.0
51,7 Bedroom House for sale in Lavington,"Lavington, Lavington, Nairobi, Nairobi",7.0,250000000.0
52,Runda-Brand New 7 Bedroom Double Storey House for sale,"Runda close to Embassies ,UN offices,International schools and shopping malls, Runda, Nairobi, Nairobi",7.0,160000000.0
53,"7 Bedroom House in Muthaiga for sale at KES 1,000,000,000","Muthaiga, Nairobi, Nairobi",7.0,1000000000.0
54,LAND SUITABLE FOR DEVELOPMENT,"Lavington, Nairobi, Nairobi",7.0,200000000.0
55,"Gigiri, 7 Bedroom House for sale","nyari estate, Gigiri, Nairobi, Nairobi",7.0,110000000.0
56,Elegant Commercial Double Storey House with Swimming Pool on 1 Acre in Lavington,"Lavington, Lavington, Nairobi, Nairobi",7.0,400000000.0
57,"Prime 10 Acre Property for sale on Miotoni Road, Karen","Miotoni Road, Karen ,Nairobi Kenya, Karen, Nairobi, Nairobi",7.0,640000000.0
58,A 7 Bedroom Villa in Karen,"Karen Marist Lane, Karen, Nairobi, Nairobi",7.0,140000000.0
59,* Runda Beautiful Brand New 7 Bedroom House,"Runda close to Braeburn school,UN offices,Embassies  and shopping malls, Runda, Nairobi, Nairobi",7.0,240000000.0
60,6 bedroom House For Sale in Garden Estate,"Garden Estate, Garden Estate, Nairobi, Nairobi",6.0,58000000.0
61,A Homely Six Bedrooms Housed in the Heart of Old Runda,"runda groove, Runda, Nairobi, Nairobi",6.0,90000000.0
62,6 Bedroom Townhouse Runda,"Pan African Insurance Ave , Runda, Runda, Nairobi, Nairobi",6.0,140000000.0
63,RUNDA:STUNNING 6BEDROOM MANSION FOR SALE,"Runda, Nairobi, Nairobi",6.0,250000000.0
64,Stunning Classic 6 Bedroom Standalone House in Lavington on 3/4 piece of land,"LAVINGTON, Lavington, Nairobi, Nairobi",6.0,270000000.0
65,Runda: Magnificent Ambassadorial,"Runda, Nairobi, Nairobi",6.0,145000000.0
66,6 Bedroom Houses in Kitisuru - Magnolia Lake Side,"Kirawa Rd, Kitisuru, Nairobi, Nairobi",6.0,140000000.0
67,6 Bedroom House For Sale In Karen (Kenya) - 3KE1346197,"Karen, Nairobi, Nairobi",6.0,79000000.0
68,6 Bedroom House For Sale In Runda (Kenya) - 3KE1354324,"Runda, Nairobi, Nairobi",6.0,73000000.0
69,6 Bedroom House For Sale In Karen (Kenya) - 3KE1500005,"Karen, Nairobi, Nairobi",6.0,85000000.0
70,Pleasant 6 Bedroom Maisonette in Golden Estate South B,"South B, Nairobi, Nairobi",6.0,23000000.0
71,Six Bedroom Townhouse with a Two BR Guest Wing in a Gated Community,"st elizabeth, Karen, Nairobi, Nairobi",6.0,90000000.0
72,Ambassadorial House-Runda,"runda, Runda, Nairobi, Nairobi",6.0,145000000.0
73,6 Bedroom House For Sale In Lavington (Kenya) - 3KE1364210,"Lavington, Nairobi, Nairobi",6.0,400000000.0
74,6 Bedroom House For Sale In Karen (Kenya) - 3KE1354364,"Karen, Nairobi, Nairobi",6.0,150000000.0
75,6 Bedroom House on 1/2 Acre Plot in New Muthaiga,"Muthaiga, Nairobi, Nairobi",6.0,170000000.0
76,Stunning 6 Bedroom Mansion for sale,"runda, Runda, Nairobi, Nairobi",6.0,160000000.0
77,6 Bedroom House in Karen  - 3KE1346197,"Karen, Karen, Nairobi, Nairobi",6.0,79000000.0
78,6 Bedroom House in Karen - 3KE1354364,"Karen, Karen, Nairobi, Nairobi",6.0,150000000.0
79,Unique 6 bedroom House For Sale in Garden Estate,"GARDEN ESTATE, Garden Estate, Nairobi, Nairobi",6.0,61000000.0
80,6 bedroom house for sale in Thome,"Thome, Thome, Nairobi, Nairobi",6.0,65000000.0
81,6 Bedroom House For Sale In Karen (Kenya) - 3KE1370980,"Karen, Nairobi, Nairobi",6.0,0.0
82,Exceptional 6 Bedroom House on 26 Acres on Kitisuru Estate - S254,"Tate Close, Kitisuru, Nairobi, Nairobi",6.0,425000000.0
83,6 Bedroom Castle House Sitting on 1/2 Acre,"Runda, Nairobi, Nairobi",6.0,110000000.0
84,6 Bedroom House for sale in Karen,"Karen,nairobi, Karen, Nairobi, Nairobi",6.0,90000000.0
85,6 Bedroom Ambassadorial House on 1.25 Acres in Old Runda,"Ruaka Drive, Runda, Nairobi, Nairobi",6.0,210000000.0
86,6 Bedroom House With 2 Detached Sqs for sale Along Thika Road,"Kenyatta Rd, Thika Road, Nairobi, Nairobi",6.0,16000000.0
87,6bedroom house for sale in old muthaiga,"Muthaiga North, Nairobi, Nairobi",6.0,400000000.0
88,"6 Bedroom Townhouse For Sale in Karen, Nairobi","Karen, Karen, Nairobi, Nairobi",6.0,95000000.0
89,6 Bedroom Townhouse Membley,"Membley, Membley, Nairobi, Nairobi",6.0,23000000.0
90,Modern 6 Br Town House,"Kitisuru, Nairobi, Nairobi",6.0,165000000.0
91,6 Bedroom Townhouse in Its Own Compound in Kileleshwa,"Mwingi, Kileleshwa, Nairobi, Nairobi",6.0,70000000.0
92,SOUTH B RIVER BANK - MAISONETTE (CONVERTED INTO  BEDSITTERS),"RIVER BANK ESTATE., South B, Nairobi, Nairobi",6.0,17000000.0
93,RUNDA - 6 BEDROOMS - ALL EN SUITE DOUBLE STOREY HOUSE,"pan african insurance road, Runda, Nairobi, Nairobi",6.0,180000000.0
94,6 Bedroom Townhouse,"Isaac gathanju road, Lavington, Nairobi, Nairobi",6.0,85000000.0
95,"6 BEDROOM, 3 LEVEL TOWN HOUSE ON SALE  IN LAVINGTON","Lavington, Lavington, Nairobi, Nairobi",6.0,65700000.0
96,Beutiful 5 Bedroom SQ,"James gichuru, Lavington, Nairobi, Nairobi",6.0,300000.0
97,6 Bedroom Townhouse for sale in Lavington,"James Gichuru, Lavington, Nairobi, Nairobi",6.0,78000000.0
98,6 Bedroom Standalone In Nyari - Pioneer Close - 1220-I,"Nyari, Nairobi, Nairobi",6.0,85000000.0
99,6 Bedroom Ambassadorial House for sale on 36 Acres in Muthaiga,"Muthaiga Rd, Muthaiga, Nairobi, Nairobi",6.0,0.0
100,"The Best of Runda , Ambassadorial House","Runda, Runda, Nairobi, Nairobi",6.0,140000000.0
101,An Executive And Modern 6 Bedroom Al En Suite Ambassadorial House on 1 Acre in Runda,"Mimosa Drive, Runda, Nairobi, Nairobi",6.0,130000000.0
102,"5 BEDROOM, 3 LEVEL TOWN HOUSE ON SALE  IN LAVINGTON","Lavington, Lavington, Nairobi, Nairobi",6.0,80000000.0
103,6 Bedroom House For Sale In Kitisuru,"Kitisuru, Kitisuru, Nairobi, Nairobi",6.0,74900000.0
104,6 Bedroom Townhouse for sale in Kileleshwa,"Laikipia Rd, Kileleshwa, Nairobi, Nairobi",6.0,120000000.0
105,A Homely Lovely Five Bedroom Town House in Runda,"Cactus Street, Nairobi, New Runda, Runda, Nairobi, Nairobi",6.0,100000000.0
106,The Ambassadorial 6 Bedroom With Sq,"Runda, Runda, Nairobi, Nairobi",6.0,140000000.0
107,"Palatial 6 Bedroom House in Karen, Bogani","Karen, Bogani, Karen, Nairobi, Nairobi",6.0,90000000.0
108,Magnificent 6 Bedrooms Villa,"Peponi  Road, Kitisuru, Nairobi, Nairobi",6.0,140000000.0
109,6 Bedroom Maisonette - Miotoni-Karen,"MIOTONI, Karen, Nairobi, Nairobi",6.0,150000000.0
110,6 Bedroom Townhouse for sale in Lavington,"Gitanga Road, Lavington, Nairobi, Nairobi",6.0,40000000.0
111,6 bedroom house for sale in Karen-3KE1370980,"Karen, Nairobi, Nairobi",6.0,0.0
112,Spectacular Family Home for sale in Karen,"Karen, Bogani Road, Karen, Nairobi, Nairobi",6.0,85000000.0
113,"Nyari, House for sale","NYARI, Nyari, Nairobi, Nairobi",6.0,90000000.0
114,6 Bedroom House in A 1/2 Acre Compound for sale- Garden Estate,"Garden Estate, Garden Estate, Nairobi, Nairobi",6.0,250000000.0
115,A Cosy Six Bedrooms Town House in Runda,"runda groove, Runda, Nairobi, Nairobi",6.0,85000000.0
116,The Crown Jewel House in Nyari,"Nyari, Nairobi, Nairobi",6.0,135000000.0
117,6 Bedroom Townhouse for sale in Kileleshwa,"Laikipia Rd, Kileleshwa, Nairobi, Nairobi",6.0,120000000.0
118,Gorgeous 6 Bedroom House in Karen - 3KE1500005,"Karen, Nairobi, Nairobi",6.0,85000000.0
119,6 Bedroom House Available for sale in Nyari,"Nyari, Nairobi, Nairobi",6.0,200000000.0
120,Townhouse for sale,"Isaac gathanju road, Lavington, Nairobi, Nairobi",6.0,85000000.0
121,Runda (old Runda) 2 Lovely 6 Bedroom mordern Houses located on a 1.068 Acre of Land,"runda, Runda, Nairobi, Nairobi",6.0,220000000.0
122,6 Bedroom  All Ensute Townhouse For Sale In Runda,"Ruaka Drive, Runda, Nairobi, Nairobi",6.0,130000000.0
123,6 Bedroom House for sale in Karen,"Bosco Road, Karen, Nairobi, Nairobi",6.0,80000000.0
124,Magnificent Ambassadorial House For Sale In Runda,"Runda, Nairobi, Nairobi",6.0,160000000.0
125,Ambassadorial House for sale,"Karen, Karen, Nairobi, Nairobi",6.0,85000000.0
126,"6 Bedroom Townhouse on Half Acre Land for sale in Nzohe Lane, Karen","Nzohe road ,Karen, Karen, Nairobi, Nairobi",6.0,92000000.0
127,2 Massionate for sale  in Kasarani at Sports View,"THIKA ROAD, Kasarani, Nairobi, Nairobi",6.0,20000000.0
128,Luxurious 6 bedroom with 2 ensuite in new kitusuru for sale.,"Kitisuru, Nairobi, Nairobi",6.0,130000000.0
129,The Ambassadorial 6 Bedroom Sq in Runda,"Runda, Runda, Nairobi, Nairobi",6.0,140000000.0
130,6 Bedroom Townhouse For Sale In Kilimani,"Elgeyo Marakwet Road, Kilimani, Nairobi, Nairobi",6.0,40000000.0
131,6 Bedroom House for sale in Nyari,"Nyari, Nairobi, Nairobi",6.0,350000000.0
132,6 Bedroom Townhouse For Sale In Lavington,"James Gichuru Rd, Lavington, Nairobi, Nairobi",6.0,70000000.0
133,6 bedroom Townhouse for sale in Karen,"Karen, Karen, Nairobi, Nairobi",6.0,85000000.0
134,Six Bedroom Townhouse for sale in Lavington,"Lavington, Lavington, Nairobi, Nairobi",6.0,80000000.0
135,6 Bedroom  Maison in New Muthaiga,"thigiri grove, Muthaiga, Nairobi, Nairobi",6.0,160000000.0
136,Beautiful Double Storey Nyari House,"Redhill, Nyari, Nairobi, Nairobi",6.0,485000000.0
137,6 Bedroom Town-House for sale in Runda,"Runda, Nairobi, Nairobi",6.0,70000000.0
138,5 Bedroom House On Grevillea Grove â€“ Elite Garden Villas,"Grevillea Grove, Grevillea Grove, Nairobi, Nairobi",5.0,75000000.0
139,5 BEDROOM 3 LEVEL AMBASSADORIAL VILLA  ON SALE IN KAREN,"Karen, Nairobi, Nairobi",5.0,100000000.0
140,Elegant 5 Bedroom House in Thigiri Ridge,"Thigiri, Nairobi, Nairobi",5.0,120000000.0
141,Prestigious and Unique! Lavington Five Bedroom Townhouse With SQ,"amboselli lavington, Lavington, Nairobi, Nairobi",5.0,65000000.0
142,A Living Legend! Lavington Five Bedroom Townhouse,"Lavington, Lavington, Nairobi, Nairobi",5.0,52000000.0
143,Suburban Oasis! Runda Mae Ridge 5 bed house,"Runda, Runda, Nairobi, Nairobi",5.0,110000000.0
144,Grand and cozy! Karen house,"Karen, Karen, Nairobi, Nairobi",5.0,80000000.0
145,5 BEDROOM VILLA HOUSE ON SALE IN KAREN,"Karen, Nairobi, Nairobi",5.0,110000000.0
146,A Luxurious 5 Bedrooms House in Runda,"Close to UN, Runda, Nairobi, Nairobi",5.0,140000000.0
147,New 5 bedroom double storey plus DSQ for sale along Bogani Rd in Karen,"Bogani Rd, Karen, Nairobi, Nairobi",5.0,100000000.0
148,World Class 5 Bedrooms all Ensuite Town House in Lavington,"Lavington, Nairobi, Nairobi",5.0,65000000.0
149,Elegant 5 Bedroom Villas in Karen,"Karen, Nairobi, Nairobi",5.0,85000000.0
150,Lower Kabete:5 Bedroom Townhouse,"lower kabete road, Lower Kabete, Nairobi, Nairobi",5.0,120000000.0
151,5 Bedroom Townhouse Karen,"Fair Acres Karen, Karen, Nairobi, Nairobi",5.0,80000000.0
152,Beautiful & Spacious 5 Bedroom Townhouse on Brookside,"WESTLANDS, Westlands, Nairobi, Nairobi",5.0,60000000.0
153,"5 Bedroom House for sale, Lavington","Njumbi Road, Lavington, Nairobi, Nairobi",5.0,95000000.0
154,World Class 5 Bedrooms with DSQ House for sale in Lavington,"Lavington, Nairobi, Nairobi",5.0,65000000.0
155,LARGE FAMILY HOME FOR SALE,"Karen, Nairobi, Nairobi",5.0,60000000.0
156,5 Bedroom Townhouse in Runda in a Gated Community,"runda water, Runda, Nairobi, Nairobi",5.0,90000000.0
157,Modern Luxurious 5 Bedroom Townhouse in Kitengela for sale,"Riruta, Nairobi, Nairobi",5.0,20000000.0
158,Luxury Home In Runda,"Ruaka Road, Runda, Nairobi, Nairobi",5.0,255000000.0
159,NEW KITISURU - 4 BEDROOMS ALL - ENSUITE DOUBLE STOREY HOUSE PLUS STUDY ROOM.,"NEW KITISURU, Kitisuru, Nairobi, Nairobi",5.0,72000000.0
160,Nasra 5 Bed Room Maisonette,"Nasra, Umoja, Nairobi, Nairobi",5.0,12500000.0
161,Spacious 5 Bedroom Townhouse for sale in Lavington,"Lavington, Nairobi, Nairobi",5.0,72000000.0
162,4 Bedroom Luxury townhouse - Lavington,"Lavington, Nairobi, Nairobi",5.0,75000000.0
163,Stunningly Beautyfull House in Runda,"Runda, Nairobi, Nairobi",5.0,190000000.0
164,Meticulous 5 Bedroom in a Gated Community,"Karen, Nairobi, Nairobi",5.0,100000000.0
165,18 0405 ST Acquire This Elegant Property Loaded with Stunning Architectural Detail. 18 04 17,"Lavington Green Near Jaffrey Club, Lavington, Nairobi, Nairobi",5.0,83000000.0
166,18 0211 SR Prime Residential Complex. 17 01 04,"Grevellia Groove, Brookside, Nairobi, Nairobi",5.0,240000000.0
167,5 Bedrooms House in Kitisuru Nairobi on Half Acre,"Kitisuru, Nairobi, Nairobi",5.0,67500000.0
168,17 1012 ST Sensational voluminous branded townhouse on offer. 17 04 22,"Lower Kabete, Lower Kabete, Nairobi, Nairobi",5.0,155000000.0
169,Stunning 5 Bedroom Town House for sale in Gated Community,"Spring Valley, Nairobi, Nairobi",5.0,65000000.0
170,A Charming 5 Bedroom all Ensuite Townhouse in Riverside Drive,"Riverside, Nairobi, Nairobi",5.0,72000000.0
171,17 1006 ST Modern living for the new lucky owner. 17 09 29,"Kitisuru Estate, Kitisuru, Nairobi, Nairobi",5.0,120000000.0
172,17 1042 ST Remarkable corner townhouse - Superb investment opportunity. 17 10 12,"Off Peponi Road, Spring Valley, Nairobi, Nairobi",5.0,80000000.0
173,TownHouse in Lavington,"Lavington, Nairobi, Nairobi",5.0,48500000.0
174,Luxurious 5 Bedrooms Very Spacious Home in Runda,"Runda, Nairobi, Nairobi",5.0,120000000.0
175,Newly Built 5 Bedroom (all Ensuite) Double Storey,"Karen, Nairobi, Nairobi",5.0,100000000.0
176,Luxurious 5 Bedrooms plus 2sq House in Karen,"Karen, Nairobi, Nairobi",5.0,60000000.0
177,Luxurious 5 Bedrooms all Ensuite plus 2 Sq Home in Kyuna,"Kyuna, Nairobi, Nairobi",5.0,100000000.0
178,Bamboo  Gardens  - New 5 Bedroom Double- Storey Plus Sq  On Eighth Acre   for sale in Ruiru,"Bamboo Gardens Ruiru, Ruiru, Nairobi, Nairobi",5.0,30000000.0
179,Modern Villa in Karen,"Karen, Nairobi, Karen, Nairobi, Nairobi",5.0,80000000.0
180,Sunrise Avenue! Karen Five Bedroom Townhouse,"karen, Karen, Nairobi, Nairobi",5.0,88000000.0
181,Golden Rays ! Westlands 5 Bedroom Townhouse,"westlands brookside drive, Westlands, Nairobi, Nairobi",5.0,135000000.0
182,Palatial 5 Bedroom House in Karen,"Karen, Nairobi, Karen, Nairobi, Nairobi",5.0,115000000.0
183,"6 Bedrooms, 2 Storey House for sale in Garden Estate Nairobi","off Garden Estate Road, Garden Estate, Nairobi, Nairobi",5.0,52500000.0
184,Stylish Urban Villa in Karen,"Karen, Nairobi, Karen, Nairobi, Nairobi",5.0,80000000.0
185,Exclusive Modern Townhouse,"Amara Ridge, Karen, Nairobi, Nairobi",5.0,110000000.0
186,5 Bedroomed Town House Under Offer,"Ongata Rongai Rangau Area, Kajiado, Nairobi, Nairobi",5.0,6900000.0
187,5 Bedroomed Town House Under Offer,"Ongata Rongai Rangau Area, Kajiado, Nairobi, Nairobi",5.0,6900000.0
188,West Tides ! Westlands 5 Bedroom Townhouse,"westlands church road, Westlands, Nairobi, Nairobi",5.0,45000000.0
189,Sun drops Oasis! Lavington 5 Bedrooms Villa.,"Lavington, Lavington, Nairobi, Nairobi",5.0,75000000.0
190,Modern Luxurious House,"kitengela, Ngong Road, Nairobi, Nairobi",5.0,15000000.0
191,Modern High End 5 Bedroom House - Ridgeways,"Ridgeways, Nairobi, Nairobi",5.0,90000000.0
192,Beautiful 5 Bedroom in Runda,"RUNDA, Runda, Nairobi, Nairobi",5.0,150000000.0
193,4 Bedroom House in on 0.5 Acre in a Gated Community.,"windy ridge, Karen, Nairobi, Nairobi",5.0,78000000.0
194,5 Bedroomed Town House at  Rangau,"ongata Rongai Rangau, Kajiado, Nairobi, Nairobi",5.0,6900000.0
195,Apartment at Nairobi,"Lavington, Lavington, Nairobi, Nairobi",5.0,100000000.0
196,"Spacious,ready 5 Bedroom House","Mwananchi road,Syokimau, Syokimau, Nairobi, Nairobi",5.0,17000000.0
197,Palatial Karen 5 Bedroom Home,"Karen, Karen, Nairobi, Nairobi",5.0,110000000.0
198,Kileleshwa 5 Bedroom Maisonette,"kileleshwa, Kileleshwa, Nairobi, Nairobi",5.0,60000000.0
199,"Lavish 5 Bedroom Townhouse with a Dsq in Lavington, Nairobi.","Lavington, Nairobi, Lavington, Nairobi, Nairobi",5.0,75000000.0
200,Masterfully Designed and Luxurious Villas,"Amara Ridge, Karen, Nairobi, Nairobi",5.0,110000000.0
201,Excellently Done 5 Bedroom Town House,"Lavington, Lavington, Nairobi, Nairobi",5.0,65000000.0
202,5 Bedroom House  in Karen (Kenya) 3ke1381571,"Karen, Nairobi, Nairobi",5.0,115000000.0
203,5 Bedroom Villa in Karen,"karen, Karen, Nairobi, Nairobi",5.0,170000000.0
204,Masterfully Designed and Townhouse Apartments,"Lavington, Lavington, Nairobi, Nairobi",5.0,75000000.0
205,Modern Townhouse,"Lavington, Lavington, Nairobi, Nairobi",5.0,75000000.0
206,Karen 5 Bedroom Town House,"Karen, Hillcrest Road, Karen, Nairobi, Nairobi",5.0,85000000.0
207,5 Bedroom Villas in Karen,"karen, Karen, Nairobi, Nairobi",5.0,170000000.0
208,5 Bedroom Luxurious House,"siaya road, Kileleshwa, Nairobi, Nairobi",5.0,285000000.0
209,Magnificent 5 Bedroom,"RUNDA, Runda, Nairobi, Nairobi",5.0,200000000.0
210,Sparkle in the Woods ! Runda 5 Bedrooms Townhouse,"runda, Runda, Nairobi, Nairobi",5.0,78000000.0
211,Exclusively Done Townhouse,"Riverside drive, Riverside, Nairobi, Nairobi",5.0,60000000.0
212,A Beautiful 5 Bedroom Townhouse in Lavington,"Lavington, Nairobi, Nairobi",5.0,65000000.0
213,Lavington 5 Bedroom (all Ensuite) Villa,"Hatheru Rd, Lavington, Nairobi, Nairobi",5.0,60000000.0
214,5 Bedroom all Ensuite in Karen,"Karen, near the Hub, Karen, Nairobi, Nairobi",5.0,100000000.0
215,5 Bedroom Townhouse Karen,"Kasuku Dr, Karen, Nairobi, Nairobi",5.0,85000000.0
216,Prestigious! Karen Five Bedroom Townhouse with SQ,"karen, Karen, Nairobi, Nairobi",5.0,90000000.0
217,"5 Br Townhouse, Lavington","Mzima Springs, Lavington, Nairobi, Nairobi",5.0,85000000.0
218,5br Townhouse at  Lavington,"Lavington, Lavington, Nairobi, Nairobi",5.0,80000000.0
219,Vacation Living! Lavington 5 Bedroom Townhouse,"Lavington, Lavington, Nairobi, Nairobi",5.0,80000000.0
220,"A Spacious 5 Bedroom all Ensuite Bungalow in Muigai Estate, Kitengela","Kitengela, Kajiado, Nairobi, Nairobi",5.0,12000000.0
221,Lavish Living ! Lavington 5 Bedroom Townhouse,"Lavington, Lavington, Nairobi, Nairobi",5.0,75000000.0
222,Townhouse in Karen,"Karen, Karen, Nairobi, Nairobi",5.0,115000000.0
223,Beautiful Townhouse with Italian Finishing in Lavington,"Lavington, Nairobi, Nairobi",5.0,75000000.0
224,House in Syokimau,"Syokimau, Nairobi, Nairobi",5.0,14000000.0
225,Runda  5 Bedroom House,"Runda, Nairobi, Nairobi",5.0,95000000.0
226,Elegant Houses in Karen,"Karen, Karen, Nairobi, Nairobi",5.0,150000000.0
227,Lavington Superb 5 Bedroom Townhouses,"chalbi drive, Lavington, Nairobi, Nairobi",5.0,70000000.0
228,5 Bedroom Townhouse For Sale In Lavington (Kenya) - 3KE1313001,"Lavington, Nairobi, Nairobi",5.0,65000000.0
229,Modern 5 Bedroom All-Ensuite House in Karen,"Karen, Nairobi, Nairobi",5.0,80000000.0
230,5 Bedroom in Kitengela New Valley Estate,"Machakos, Nairobi, Nairobi",5.0,8000000.0
231,5 Bedroom Townhouse For Sale In Kilimani (Kenya) - 3KE1348541,"Kilimani, Nairobi, Nairobi",5.0,53608246.0
232,Bright and Spacious Townhouse,"Lavington, Nairobi, Nairobi",5.0,75000000.0
233,5 Bedroom House for Rent/sale in a Gated Comunity  in Lavington,"AMBOSELI GARDENS, Lavington, Nairobi, Nairobi",5.0,75000000.0
234,Karen 5 Bedroom Townhouse,"Karen, Karen, Nairobi, Nairobi",5.0,80000000.0
235,"5 Bedroom House in Mwihoko, Nairobi","Githurai, Nairobi, Nairobi",5.0,12500000.0
236,Classy 5 Bedrooms Executive Townhouse for sale in Lavington,"Lavington, Nairobi, Nairobi",5.0,110000000.0
237,Lovely 5 Bedroom with servant quarters (sq) for sale in kitisuri,"Kitisuru, Nairobi, Nairobi",5.0,60000000.0
238,Luxurious 5 Bedroom with SQ in Lavington,"Lavington, Nairobi, Nairobi",5.0,65000000.0
239,5 Bedroom House For Sale In Ridgeways (Kenya) - 3KE1374150,"Ridgeways, Nairobi, Nairobi",5.0,86000000.0
240,5 bedroom plus 2 DSQ,"Runda, Runda, Nairobi, Nairobi",5.0,85000000.0
241,Lavish 5 Bedroom House in Karen,"Karen, Nairobi, Nairobi",5.0,115000000.0
242,5 Bedroom House for sale at Donyo Sabuk,"Donyo Sabuk, Westlands, Nairobi, Nairobi",5.0,150000000.0
243,"5 Bedroom Home on 06 Acres, Muthaiga","Coffee Garden Drive, Muthaiga, Nairobi, Nairobi",5.0,70000000.0
244,Luxurious 5 Bedroom Villas in Karen,"Karen, Karen, Nairobi, Nairobi",5.0,80000000.0
245,Luxurious 4 Storey Townhouse,"Lavington, Nairobi, Nairobi",5.0,95000000.0
246,Beautiful 5 Bedroom All Ensuite Townhouse in Lavington,"Nairobi, Nairobi",5.0,75000000.0
247,Very Spacious Luxurious 5 Bedroom House Stand Alone Species in Mountain View,"Mountain View, Nairobi, Nairobi",5.0,60000000.0
248,5 Bedroom Townhouse For Sale In Lavington (Kenya) - 3KE1365606,"Lavington, Nairobi, Nairobi",5.0,58500000.0
249,5 Bedroom House For Sale In Karen - 3ke1342762,"Karen Plains, Karen, Nairobi, Nairobi",5.0,60000000.0
250,An Elegant and Beautiful 5 Bedroom House on 1 Acre in Muthaiga,"Muthaiga, Muthaiga, Nairobi, Nairobi",5.0,270000000.0
251,County cottage! Lavington Five Bedroom Townhouse With SQ,"Lavington, Lavington, Nairobi, Nairobi",5.0,55000000.0
252,Townhouse at Lavington,"Lavington, Nairobi, Nairobi",5.0,95000000.0
253,5 Bedroom Unfinished Villa in Utawala,"Utawala, Utawala , Nairobi, Nairobi",5.0,10000000.0
254,5 Bedroom Townhouse in Lavington,"Amboseli Road, Lavington, Nairobi, Nairobi",5.0,58500000.0
255,5 Bedroom Townhouse For Sale In Lavington (Kenya) - 3KE1302400,"Lavington, Nairobi, Nairobi",5.0,58000000.0
256,House at Muhugu Park- Karen,"Karen, Karen, Nairobi, Nairobi",5.0,65000000.0
257,Very Spacious Luxurious 5 Bedrooms House for sale in Kiambu Road,"Runda, Nairobi, Nairobi",5.0,50250000.0
