index,desc,location,size,value
1205,This is a Beautiful and well maintained 3 bedrooms master ensuite double storied house sitting on approximately half acre mature ...,"Pan African Insurance Ave Kitisuru, Runda, Nairobi",3.0,80000000.0
1206,"3 bedroom all ensuite for sale in Kileleshwa Located in the quiet cul de sac of Gatundu Close, off Nyeri Road in...","Kileleshwa, Nairobi",3.0,24000000.0
1207,"This 3 bedroom mansionette is located in Kileleshwa within a gated community. It has an sq, master ensuite and great security and...","Kileleshwa, Nairobi",3.0,32000000.0
1208,"3 bedroom Maisonette within riverbank estate phase 2, with servant quarter and 4 bedsitters all rented out with an income of kshs...","South B, Nairobi",3.0,16000000.0
1209,>located 200 metres from tarmac >gated community >manicured garden >water and electricity on site >large living and dinning rooms...,"Rimpa Rd Kajiado County, Ongata Rongai, Nairobi",3.0,5700000.0
1210,This is a 3 bedroom master en suite bungalow in Kahawa sukari Sitting on an 1/4 of an acre with a two...,"Kahawa sukari, Nairobi",3.0,20000000.0
1211,"Waterfront- This is a 3 bedroom maisonette in a beautiful, serene and secure development in Loresho, off Waiyaki Way. The propert...","Loresho, Waiyaki Way, Loresho, Nairobi",3.0,31000000.0
1212,wonderful 3 bedroom house for sale in kiambu road. has spacious well lit rooms. has power and water supply. has a fronta...,"Kiambu Road, Nairobi",3.0,28000000.0
1213,wonderful 3 bedroom house for sale in kiambu road. has spacious well lit rooms. has power and water supply. has a fronta...,"Kiambu Road, Nairobi",3.0,28000000.0
1214,This well price 3 bedroom bungalow is nestled on 1/8 acre in an established neighborhood near Rimpa Estate. It comprises of: -Spa...,"Ongata Rongai, Nairobi",3.0,5800000.0
1215,3 BEDROOM Bungalow Rongai Nkoroi for sale. This is a nice 3 bedroom master ensuite bungalow in ongata rongai- Nkoroi. It is...,"Magadi Rd Kajiado County, Ongata Rongai, Nairobi",3.0,7500000.0
1216,- This is 3BR 2 ensuite Bungalow on 1/8th acre Plot located in ongata rongai - 500 metres from the tarmac road...,"Ongata Rongai, Nairobi",3.0,5500000.0
1217,This upscale 3 bedroom apartment comprises of: -Spacious interiors -Living cum dining -Master bedroom is en-suite -Top notch 24 h...,"Embakasi, Nairobi",3.0,8500000.0
1218,Nyayo Embakasi houses for sale in Nairobi Kenya in a secure gated community. The Nyayo Embakasi property for sale in Kenya is...,"Nyayo Estate, Embakasi, Embakasi, Nairobi",3.0,13500000.0
1219,Situated in the most sought after neighborhood in Nyayo Estate is this well maintained 3 bedroom apartment that comprises of: -Sp...,"Nyayo, Nairobi",3.0,8500000.0
1220,This is a spacious 3 bedroom master en suite in Ongata Rongai. It is in a gated community. It has spacious rooms...,"Ongata Rongai, Nairobi",3.0,6500000.0
1221,A cozy 3 bedroom house tucked within the heart of South C within a private gated community with good security. This is...,"South C, Nairobi",3.0,18000000.0
1222,1. Master bedroom is en suite along with one other bedroom. Other bedroom has an external bathroom. All rooms come with spacious....,"Ndemi Ln Woodley, Kilimani, Nairobi",3.0,26500000.0
1223,This is a 3 bedroom master en suite in Ongata Rongai near the SGR Station. It is app 300 m off the...,"Ongata Rongai, Nairobi",3.0,5500000.0
1224,This is a nice 3 bedroom master en suite in Ongata Rongai. It is in a gated community of 12 similar units.,"Ongata Rongai, Nairobi",3.0,5600000.0
1225,"Located in Ongata rongai, nkoroi suburb in the serenity, gated secured community The estate comprises of 3 br bungalows, Modern f...","nkoroi road, Ongata Rongai, Nairobi",3.0,5600000.0
1226,"Nestled in a cul-de-sac, in one of the most sought after estates in south B is this, well taken care of 3bed...","Plainsview Estate Phase 5, South B, Nairobi",3.0,22000000.0
1227,This homely 3 bedroom bungalow is situated in an established neighborhood that enjoys easy access. It is situated 200metres from ...,"Ongata Rongai, Nairobi",3.0,5800000.0
1228,-Off Kamiti Rd opposite Jacaranda estate seated on 1/4 an acre -Easy access to Northern bypass. -Master ensuite -Garden & well ma...,"Kiamumbi, Nairobi",3.0,16000000.0
1229,Spacious and lovely house in a secure gated community strategically located in View Park Mlolongo which is 20 km from Nairobi's c...,"A 104 Mlolongo, Mlolongo, Nairobi",3.0,9500000.0
1230,This is an excellent 3 bedroom 2 en suite in Ongata Rongai. It has very spacious bedrooms with in built wardrobes. It...,"Ongata Rongai, Nairobi",3.0,7600000.0
1231,Three bedroom maisonette two ensuite with dsq in a gated community,"mombasa road, Mlolongo, Nairobi",3.0,9500000.0
1232,Spacious 3 bedroom plus sq for sale Gitanga road Valley arcade. Asking 13m.,"Valley Arcade, Nairobi",3.0,13000000.0
1233,Features -all ensuite -garden -pantry -stand alone -parking,"32 Bendera Ln, Spring Valley, Nairobi",3.0,90000000.0
1234,"This is a very nice 3 bedroom house, one en suite with a separate bathroom. The house is on a half an...","Off Kikuyu - Ndenderu road, Lower Kabete, Nairobi",3.0,15000000.0
1235,Beautiful 3 BR house in Ongata Rongai - Nkoroi along Rongai - Kiserian highway. Has high quality finishes . All rooms are...,"Ongata Rongai, Nairobi",3.0,6800000.0
1236,3 bedroom plus sq apartment for sale in Lavington. Property features: -Spacious bedroom and all ensuite. -Back up generator. - Bo...,"Lavington, Nairobi",3.0,28000000.0
1237,We are selling 3 bedroom bungalow in Ongata rongai near Ack Good Shepherd Emmanuel road 400m from Rongai Kiserian Road. This home...,"Ongata Rongai, Nairobi",3.0,5800000.0
1238,"This property for sale in Nairobi Langata has three bedrooms, 3 toilets and a self contained servant quarter. It also has suffici...","Block C Mugumoini, Langata, Nairobi",3.0,17500000.0
1239,"This is a classic 3 bedroom master en-suite in Ongata Rongai -Rimpa in a gated community of similar units, There is a...","Rimpa area-Ongata Rongai, Ongata Rongai, Nairobi",3.0,5500000.0
1240,This homely 3 bedroom bungalow is nestled on 1/8 acre in an established neighborhood. It comprises of: -200 metres from tarmac -S...,"Ongata Rongai, Nairobi",3.0,5800000.0
1241,"Very spacious 3 BR house in Ongata Rongai - Rimpa. All rooms are quite spacious including the sitting area , kitchen, dinning...","Ongata Rongai, Nairobi",3.0,6000000.0
1242,Very beautiful 3 BR Houses in Ongata Rongai just 400m from Rongai - Kiserian highway. Are in an exclusive location with very...,"Ongata Rongai, Nairobi",3.0,5600000.0
1243,The propertyâ€™s greatest appeal is its potential for redevelopment given its proximity to the CBD. A number of old buildings have ...,"Langata Rd Nairobi West, Nairobi West, Nairobi",3.0,30000000.0
1244,This is a 3 br house sitting on an 1/8 acre plot. It is about 1 km from tarmac to wangige. The...,"Off kikuyu - Ndenderu rd chura, Kabete, Nairobi",3.0,5500000.0
1245,This is a nice 3 bedroom master en suite in Ongata Rongai n ear the Tuskys Chap Chap. It has been occupied...,"Ongata Rongai, Nairobi",3.0,5800000.0
1246,"Description: A uniquely situated double storey house, overlooking Windsor having the benefit of the Windsor security. One of the ...","Windsor, Ridgeways, Nairobi",3.0,160000000.0
1247,"3 bedrooms mainsonate with deterched sq, on 0. 0717 of an acre at Ngei 11estate.","Langata road, Langata, Nairobi",3.0,16000000.0
1248,"This is a spacious three bedroom apartment located in South B, Golden Gate estate. It has its own compound with four separate...","Golden Gate Estate, South B, Nairobi",3.0,25000000.0
1249,Maisonette for sale. ? Three bedroom ? Master en-suit ? Servant quarter ? Adequate parking.,"Embakasi, Nairobi",3.0,12000000.0
1250,"-3 Bedroom double storey , -Master en-suite, -Spacious kitchen, -Laundry area, -Lounge cum dining, -Big terrace, -Mature garden, ...","Pan African Insurance road, Runda, Nairobi",3.0,77000000.0
1251,"Exquisite homes in a gated compound with lovely spacious balconies overlooking the Oloolua forest, on your way to Kiserian. This ...","Karen, Nairobi",3.0,7000000.0
1252,>located 200 metres from Tarmac >gated community >fully fenced >water and electricity on site >ready title deed >for more details...,"Magadi Rd Kajiado County, Ongata Rongai, Nairobi",3.0,5800000.0
1253,"This property for sale in Nairobi Buruburu area is well maintained and has a current rental income of Kes 37, 000. The...","Ol Pogoni Rd Uhuru, Buruburu, Nairobi",3.0,8200000.0
1254,"This is a classic 3 bedroom master en suite in Ongata Rongai near the Thorn Tree School, It is in a serene...","Ongata Rongai, Nairobi",3.0,6800000.0
1255,The property to let on Mombasa road is in a secure gated community. The house has a self contained servant quarter. Specification...,"Musau Rd Mlolongo, Mlolongo, Nairobi",3.0,11900000.0
1256,Spacious 3 bedroom for sale in Kileleshwa. Property features: -Modern kitchen. -Spacious master bedroom. Asking 20m.,"Kileleshwa, Nairobi",3.0,20000000.0
1257,"Situated in an established neighborhood, is this spacious 3 bedroom bungalow nestled on an eighth of an acre. It comprises of: -M...",,3.0,5800000.0
1258,"This is a 3 bedroom house in ongata rongai rimpa going for 5. 7m ono The house is in a gated community,...","Rimpa Rd Kajiado County, Ongata Rongai, Nairobi",3.0,5700000.0
1259,"Three bedroomed maisonette for sale in South B, next to Railway Training Institute Features: Master en-suite Master bedroom has a...","South B, Nairobi",3.0,12500000.0
1260,"An elegant 3 bedroom apartment with good natural lighting; master en-suite With an open-plan kitchen, living room with a fireplac...","Runda, Nairobi",3.0,80000000.0
1261,"A well located 3 bedroom bungalow at Kiamumbi estate for Sale, spacious lounge with good lighting, plot size 1/8 acre , large...","Driveway-Kiamumbi estate, Kiamumbi, Nairobi",3.0,12000000.0
1262,These are 3 bedroom maisonettes master en-suite with Dsq located in Donholm off the Outering highway. Close proximity to a shoppi...,"Donholm, Nairobi",3.0,15000000.0
1263,These are 3 bedroom maisonettes master en-suite with Dsq located in Donholm off the Outering highway. Close proximity to a shoppi...,"Donholm, Nairobi",3.0,15000000.0
1264,This is a new 3 bedroom 2 en suite in Ongata Rongai. It is in a complex of nice residential houses. Each...,"Ongata Rongai, Nairobi",3.0,5300000.0
1265,Elegant 3 bedroom maisonette with ensuite master bedroom and DSQ located in Banque Estate off Mombasa Road and the New Likoni Lin...,"Mombasa Rd, Nairobi",3.0,20000000.0
1266,"a 3 bedroom bungalow all master ensuite, with the following amenities. dsq, spacious lounge with fire place, in build closets, we...","muthaiga road., Muthaiga, Nairobi",3.0,250000000.0
1267,This is a 3 bedroom 2 en suite in Ongata Rongai near the tarmac. It is in a gated community of 6...,"Ongata Rongai, Nairobi",3.0,5400000.0
1268,"We have been authorized to sell a 3 bedroom house in Rongai, nkoroi area. The house is in a gated community and...","Unnamed Road Kajiado County, Ongata Rongai, Nairobi",3.0,11000000.0
1269,"Neat-cozy 3bedroomed bungalow, master en-suite, ample and secure parking, magadi rd, 800m from main rd, close to social amenities","Magadi rd, Ongata Rongai, Nairobi",3.0,5800000.0
1270,3 bedroom spacious house for sale in Syokimau buld on 50*100 plot in a gated community. Selling 9. 5m.,"Syokimau, Nairobi",3.0,9500000.0
1271,"~3 Bedroom, monthly rental income of 25K. ~Price 6. 9m location: Rongai Arap Moi Stage.","Magadi Rd Nairobi, Ongata Rongai, Nairobi",3.0,6900000.0
1272,"The house is located in a gated community, 3 bedrooms with DSQ, two ensuite. Each house has its own compound and sits...","Syokimau, Nairobi",3.0,13000000.0
1273,This is a three bedroom house on a 50 by 100 plot it has the following features specious kitchen and dining area...,"Queens Ln Uthiru, Uthiru, Nairobi",3.0,10000000.0
1274,A uniquely designed 3 br Bungalows in a serene gated community located along Kenyatta rd 100 meters off tarmac and 10 minutes...,"Kenyatta, Nairobi",3.0,3550000.0
1275,Very beautiful 3 BR House in Ongata Rongai. All rooms are very spacious . The compound is also very spacious. The finishing...,"Ongata Rongai, Nairobi",3.0,7500000.0
1276,These exquisite 3 & 4 bedroom Mediterranean styled villas are built in a secure gated community along Kiambu road with the follow...,"Kiambu Road, Nairobi",3.0,30000000.0
1277,"The Bungalow is 2002 build, on a gated community, off Amboseli Lavington West, next to a small shopping, named North End, it...","Amboseli road, Lavington, Nairobi",3.0,28000000.0
1278,"Strategically located along Mombasa road, 15 minutes drive to Jomo Kenyatta International Airport. Gateway mall stands 50 meters ...","Syokimau, Nairobi",3.0,12500000.0
1279,Very prime 1 acre land with an old house on the very sought after area of old muthaiga walking distance from the...,"MUTHAIGA ROAD, Muthaiga, Nairobi",3.0,265000000.0
1280,Exclusive 3 bedrooms mansion with amazing decors and finishing it has a servant quarters Ample parking space with tight security ...,"SOUTH C, South C, Nairobi",3.0,19000000.0
1281,"A 3 bedroom stand alone massionate in half an acre land in Runda for sale. Master ensuite with a a bathtub, with...","Runda Grove Kitisuru, Runda, Nairobi",3.0,80000000.0
1282,3 bedroom beautiful and stunning mansionate located in a secure and serene environment of the famous Nyayo Embakasi estate. Locat...,"Resolving address..., Nyayo, Nairobi",3.0,12500000.0
1283,"This 3 bedroom maisonette is appx 500mtrs from Mombasa Road. It feature; master bedroom ensuite, spacious lounge, dining area and...","Mombasa Road, Syokimau, Nairobi",3.0,12000000.0
1284,"This 3 bedroom maisonette is appx 500mtrs from Mombasa Road. It feature; master bedroom ensuite, spacious lounge, dining area and...","Mombasa Road, Syokimau, Nairobi",3.0,12000000.0
1285,"3 bed-master ensuite maisonette. Detached self-contained servant quarter, In a gated community of houses. Very reliable water and...","Donholm, Nairobi",3.0,11500000.0
1286,Onyonka Estate - Langata A 3 bedroom Maisonette with separate Servant Quarter within a gated community. The house has elegant fin...,"Spacious 3BRM Maisonette with separate SQ within Onyonka Estate, in Langata FOR SALE!, Langata, Nairobi",3.0,15500000.0
1287,"A spacious Maisonette located in the urban sprawl that is South B, opposite St. Teresa Girls' High School - with a Servant's...","3 Bedroom Maisonette with SQ and Shops in Plainsview Estate, South B, South B, Nairobi",3.0,19000000.0
1288,"This charming, amazing split-level bungalow is located in the suburb of Old Runda- in a serene and quiet area. Sitting on a...",,3.0,69000000.0
1289,3 bedroom house with a servant quarter on an 1/8 of an acre for sale in a gated community in Lavington West.,"Lavington, Nairobi",3.0,19000000.0
1290,"Very spacious, modern, all ensuite with DSQ. 3 and 4 bedroom apartments all esuite, very spacious and secure. Other features incl...","Kileleshwa, Nairobi",3.0,25500000.0
1291,This is a nice 3 bedroom master en suite in Ongata Rongai. It is in a gated community in Laiser Hill behind...,"Ongata Rongai, Nairobi",3.0,14000000.0
1292,10 Meters from main road 3 Bedroom 8M,"Magadi Rd Nairobi, Ongata Rongai, Nairobi",3.0,8000000.0
1293,Impressive 3 Bedroom House on Â½ acre in Karen. It also has a great potential as a redevelopment site? (e. g two...,"Dagoretti Rd, Nairobi, Kenya, Karen, Nairobi",3.0,50000000.0
1294,This development (Situ Development) on 29. 4 Acres of land is nestled in the scenic ravine of the Mbagathi and Ololua Ridges...,"Karen, Nairobi",3.0,41500000.0
1295,This 3 Bedroom maisonette on 1/8 acre is located 150m from Namanga road in a gated community. The master is en-suite and...,"Mlolongo, Nairobi",3.0,14000000.0
1296,"Its a 3bdrm maisonette with a Dsq up for sale in the suburb areas of Nairobi south c , has a separate...","mgugani  rd, South C, Nairobi",3.0,14000000.0
1297,Houses for sale in Nairobi Mombasa road near Mlolongo. These Bungalow houses for sale are about 300 metres from Nairobi Mombasa h...,"off Mombasa road, Mlolongo, Nairobi",3.0,7900000.0
1298,"The house are located in rongai , 300mtrs from the road, They are very spesious and master bedroom is ensuit. Borehole water...","Ongata Rongai, Nairobi",3.0,5600000.0
1299,Conviniently located colonial 3br bungalow set on nice beautiful mature GARDEN 0. 6 acre plot. Ideal for DEVELOPMENT OF APARTMENT...,"Lavington, Nairobi, Lavington, Nairobi",3.0,125000000.0
1300,"This Plot has a rental income from the two 3bedroom apartment (45, 000 Each), it is in gated community in Kasarani, appx...","Sportview Road, Kasarani, Nairobi",3.0,12000000.0
1301,"Is in Ongata Rongai - Rimpa , 250 m from the Rongai - Kiserian tarmac . Is in a well developed area.","Ongata Rongai, Nairobi",3.0,6500000.0
1302,"Property on sale in Rongai, Nkoroi Off Magadi rd close to The Smith Hotel. The property is 200 metres from the magadi...","Magadi Rd Kajiado County, Ongata Rongai, Nairobi",3.0,11000000.0
1303,"Its a three bedroom master ensuite , four hundred metres behind astrol petrol station opposite GSU Eatern Bypass . Call now for...","Utawala, Nairobi",3.0,11000000.0
1304,3 bedrooms beautifully designed maisonette in a serene neighborhood. Amenities include: â€¢	Spacious 3 bedrooms â€¢	Kitchen with stor...,"highview estate, Ngumo estate, Nairobi",3.0,15000000.0
1305,"A lovely 3 bedroom master ensuite bungalow that is well maintained, sitting on 0. 28 acre with a nice well-manicured garden in...","Koma Rock, Nairobi",3.0,7000000.0
1306,"Selling a 3 bedroom house with a servant quarter in a gated community in Lavington west. Master ensuite, garden, very secure and....","Lavington, Nairobi",3.0,25000000.0
1307,"~ 3 bedrooms master ensuite, family room, guest room plus SQ ~ On 0. 502 acres 99yrs lease since 1991. ~ very...","Muthangari Gardens Maziwa, Lavington, Nairobi",3.0,155000000.0
1308,This is a nice and new 3 bedroom master ensuite bungalow in kiserian near the Tarmac. It is In a gated community...,"Ongata rongai , Ongata Rongai, Nairobi",3.0,5100000.0
1309,"- Available for sale in Ongata Rongai - 3bedrooms, 2 ensuite - Well manicured compound with a kitchen garden. - Perimeter wall...","Ongata Rongai, Nairobi",3.0,8000000.0
1310,"Beautiful and secure bungalow 3bedrooms master en-suite with bathtub and shower, Lovely Dinning cum lounge with fire place open t...","Mzima Springs Rd, Nairobi, Kenya, Lavington, Nairobi",3.0,145000000.0
1311,- Available for sale in Ongata Rongai - In a gated community - Built on 1/8Acre of land - Near tarmac -...,"Ongata Rongai, Nairobi",3.0,5500000.0
1312,A three-bedroom master en suite maisonette comprising of: Ground Floor Living room with door to yard Kitchen Cloak room Store ben...,"Ngumo estate, Nairobi",3.0,17500000.0
1313,This Buruburu property for sale in Nairobi has a single room extension at the back. It is located close to Buruburu shopping...,"Ol Donyo Lengai Rd, Nairobi, Kenya, Buruburu, Nairobi",3.0,8300000.0
1314,"Property sits on 0. 8 acres in a gated 10 acres property. 										 4 bedroom, 3 Sharing and master ensuite										 All bedroo...","Karen, Nairobi",3.0,73000000.0
1315,"This is a delightful single storey house set on 0. 5 acres. It boasts contemporary fittings, ample space and offers privacy. Acco...","Dagoretti Road, Karen, Nairobi",3.0,50000000.0
1316,"Has 3br all ensuites, wooden floors in all bedrooms, spacious lounge separate from dinning room. Well spaced kitchen with enough ...","South B, Nairobi",3.0,25000000.0
1317,"When we were all younger, we always looked forward to the holidays camps. Main reason being the amazing environment that we would...","Karen, Nairobi",3.0,
1318,"~ 3 bedrooms, Common bathroom bungalow. ~ plot size 40x60, AND GARDEN. ~ perimeter wall with razor wire. ~ borehole available.","Kangundo Rd KE, Joska, Nairobi",3.0,5000000.0
1319,This is a 3 bedroom master en suite in Ongata Ronai. It is in an estate of more than 50 similar units.,"Ongata Rongai, Nairobi",3.0,8000000.0
1320,"This 3 bedroom mansionette is located in Lavington near valley arcade. It has a borehole, good security and ample parking.","Lavington, Nairobi",3.0,25000000.0
1321,"Its a beautiful modern 3bdrm maisonette , all en suite, has a separate dining area, living room, big kitchen, balcony, Dsq, its...","athi river, Mombasa Rd, Nairobi",3.0,13000000.0
1322,This is a nice 3 bedroom master en suite in Ongata Rongai Nkoroi. It sits on 1/8 acre and has a clean...,"Ongata Rongai, Nairobi",3.0,7000000.0
1323,This is a nice 3 bedroom 2 en suite bungalow in Ongata Rongai. It is in a gated community app 200m from...,"Ongata Rongai, Nairobi",3.0,5600000.0
1324,A well maintained 3 bedroom mansionate on sale in Buru Buru phase 1. It comprises of : ~ Master ensuite ~ Common...,"Mumias S Rd Uhuru, Buruburu, Nairobi",3.0,6800000.0
1325,This 3 Bedroom Mansionette is up for sale in Lavington near valley arcade. -It is Master ensuite -Has wooden floors -Family room....,"Lavington, Nairobi",3.0,30000000.0
1326,"the property is amazing, next to Valley arcade mall and public transport available, school and hospital walking distance and full...","Lavington, Nairobi",3.0,15000000.0
1327,This 3 Bedroom bungalow is located at Zambia next to Baptist Calvary Church and School before Ngong Town overlooking Ngong Hills....,"Ngong Rd, Nairobi",3.0,10000000.0
1328,3-bedroomed. Has garden in backyard. Sitting room with dining area. Guest WC Secure property Parking space for 2 cars,"Southlands Estate, Langata, Nairobi",3.0,14500000.0
1329,"A Nice 3 bedroom bungalow with lounge cum dining, kitchen with door to laundry, parking in front and garden at the back...","Buruburu, Nairobi",3.0,8000000.0
1330,Close proximity to WILSON AIRPORT and NAIROBI NATIONAL PARK. An enchanting cozy 3br lavish bungalow set on 8th of acre plot. Spac...,"Langata Nairobi , Langata, Nairobi",3.0,16000000.0
1331,This is a nice 3 bedroom all en suite in Ongata Rongai Laiser Hill. It sits on 1/8 acre and has a...,"Ongata Rongai, Nairobi",3.0,7500000.0
1332,A 3 Bedroom maisonette (Master ensuite) with Staff quarters for 2 in a quiet and serene neighborhood. The house comprises of: Lou...,"Kileleshwa, Nairobi",3.0,32000000.0
1333,"This house whose location is at Mucatha has one master en-suite, a large living room with separate dining area and a kitchen...","Mucatha, Nairobi",3.0,9000000.0
1334,House Details: This is a 3 bedroom all ensuite Maisonette with sq in Karen on an acre. It has two sitting rooms...,"Karen, Nairobi",3.0,60000000.0
1335,House Details: This is a 3 bedroom all ensuite Maisonette with sq in Karen on an acre. It has two sitting rooms...,"Karen, Nairobi",3.0,60000000.0
1336,This is a well built to standard villa in a secure gated community off Kiambu road. few minutes drive to Runda and...,"Church Rd Kiambu County, Kiambu Road, Nairobi",3.0,23000000.0
1337,Thanks for the interest in Kitisiru Gardens Project Kitisuru gardens is a privileged lifestyle in an enviable location. It is a g...,"Kitisuru, Nairobi",3.0,10000000.0
1338,The bungalow sits on a 1/3 of an acre. it's a 3br 2 bath. with a kitchen and a dinning area. All...,"Murishu Rd Nairobi, Karen, Nairobi",3.0,75000.0
1339,Tamarind valley at Embakasi is a well planned estate comprising of 850 units of varying configurations (apartments and maisonette...,"Tamarind Valley, Embakasi, Nairobi",3.0,9500000.0
1340,"Nestled on roughly 30 by 70 piece of land is this well maintained 3 bedroom bungalow with a staff quarter and its,...","Jamhuri, Nairobi",3.0,15000000.0
1341,"Its 3 bedroom all en-suits plus servant quart with all facilities . generator swimming pool, gym, with fitted kitchen along River...","Riverside, Nairobi",3.0,45000000.0
1342,"Purple Haze Apartments is a state of the art development that will consist of 216 units, spread over two blocks housing 102...",,2.0,23000000.0
1343,This is a 2 bedroom master en suite in Ongata Rongai Maasai Lodge Rd. It is in a very secure and serene...,"Ongata Rongai, Nairobi",2.0,4900000.0
1344,A very spacious pent house for sale in Kilimani with 2 bedroom all en suite . It has the following features :...,"Kilimani, Nairobi",2.0,16000000.0
1345,A very spacious pent house for sale in Kilimani with 2 bedroom all en suite . It has the following features :...,"Kilimani, Nairobi",2.0,16000000.0
1346,This is a 2 bedroom house in Ongata Rongai Rangau. It sits on 1/4 acre. It has a clean freehold title deed.,"Ongata Rongai, Nairobi",2.0,2200000.0
1347,"2 Bedroom Apartment For sale on Ngong Road. This apartment is located in Ngong road. It has lovely finishes, it is master...","Ngong Rd, Nairobi",2.0,10500000.0
1348,"This 2 Bedroom guestwing is located in a serene, private compund in Muthaiga. The compound has a large garden and the tenant...","Muthaiga North, Nairobi",2.0,55000.0
1349,This Ruaka Apartment for sale is about 250 metres of Limuru road and is located close to Ruaka town. It is close...,"Gituamba Gachie Rd Ruaka Town, Ruaka, Nairobi",2.0,8700000.0
1350,This property for sale in Nairobi Njiru is about 200 metres off Kangundo road. It has two single rooms and two bedrooms...,"Resolving address..., Njiru, Nairobi",2.0,3700000.0
1351,"Located in Ayani Estate Kibera The property consists of 3No 2 bedroom units. The main house and two, well-constructed extensions....","Kibera, Nairobi",2.0,13500000.0
1352,"2 BR Apartments 70sqm @4. 95M, 3 BR Apartments 100sqm @6. 8M, 2 BR Semi Detached Bungalow 66sqm @6. 1M, 2 BR...","Utawala, Nairobi",2.0,6100000.0
1353,A well maintained 2 bedroom bungalow with a 2 bedroom extension. Each unit has its own : Living room /dining room Kitchen...,"Buruburu, Nairobi",2.0,15500000.0
1354,"The plot has 27 units of 1BR self contained houses, we are looking for a serious buyer, the price is 30m, .","Dagoretti, Nairobi",1.0,30000000.0
